[
  {
    "name": "server",
    "class": "di.container.example.server.NodeJSWebServer",
    "scope": "prototype",
    "constructor-args": [
      {
        "type": "di.container.example.database.PostgresDataBase",
        "ref": "dataBase"
      },
      {
        "type": "java.lang.String",
        "value": "active"
      }
    ]
  },
  {
    "name": "dataBase",
    "class": "di.container.example.database.PostgresDataBase",
    "scope": "singleton",
    "constructor-args": [
      {
        "type": "java.lang.Integer",
        "value": 15
      }
    ]
  }
]